{"schema":"ssp.advice.v1","id":"advice-envelope-0001","case_id":"case-0001","emitted_at":"2026-07-28T00:05:00Z","expires_at":"2026-07-29T00:00:00Z","routing_epoch":7,"registry_revision":12,"registry_hash":"sha256:ffffffffffffffffffffffffffffffffffffffffffffffffffffffffffffffff","author_key_id":"dispatcher-key-2026-07","signature_alg":"ed25519","body":{"case_commitment":"sha256:5f52441b39f4f788eb0801112f884f210231f93dcdffb8fb2de8f4a59d3cc8c4","text":"Synthetic confidential advice detail for the owning edge.","public_summary":"Inspect the approval request and explain the bounded next step."},"signature":"xycxBw2XPregvU17Zpk8GKcS3MQ4fnycHTkuPL9nmJmCtTEbyWDCvtF4PEVOelfQ4_vERmEPYAGaOtmOMgf_CQ"}
